Name,Index,Status,Description,Requirements,Scope,Laundromat RE Opdrachten,Laundromat AI To-do List
Identificatie van sleutelpartners,1.1,Done,Identificeer en analyseer belangrijke externe partnerschappen en leveranciers die essentieel zijn voor de bedrijfsvoering.,"Analytisch vermogen, Communicatievaardigheden, Marktonderzoek vaardigheden","Inclusief marktonderzoek, bestaande relaties, en potentieel nieuwe partnerschappen. Exclusief interne stakeholders en non-strategische allianties.",I want to create a Business model canvas for a marketing company. (https://www.notion.so/I-want-to-create-a-Business-model-canvas-for-a-marketing-company-1d4f77e229914c2f97243a94c0329aaa?pvs=21),"Marktanalyse voor potentiële partners (https://www.notion.so/Marktanalyse-voor-potenti-le-partners-64cf1676f00f41879ba30b872f9c9edb?pvs=21), Evaluatie van bestaande partnerships (https://www.notion.so/Evaluatie-van-bestaande-partnerships-7546dc4f345f410292dadf4951b2d5ed?pvs=21), Ontwikkeling van nieuwe partnerschappen (https://www.notion.so/Ontwikkeling-van-nieuwe-partnerschappen-27e462f82f0d44f0834e8526cd74d71d?pvs=21)"
Definiëren kernactiviteiten,1.2,Done,"Bepaal de primaire operationele procedures, van marketing tot klantenservice, die nodig zijn voor het leveren van de waardepropositie.","Operationeel inzicht, Procesmanagement, Strategisch plannen","Inclusief marketingstrategieën, klantenservice procedures, en operationele systemen. Exclusief niet-strategische of administratieve processen.",I want to create a Business model canvas for a marketing company. (https://www.notion.so/I-want-to-create-a-Business-model-canvas-for-a-marketing-company-1d4f77e229914c2f97243a94c0329aaa?pvs=21),"Analyseren van marktbehoeften (https://www.notion.so/Analyseren-van-marktbehoeften-1cf0f65e0758461d8edf6b25c33156c4?pvs=21), Verbeteren van operationele systemen (https://www.notion.so/Verbeteren-van-operationele-systemen-257ac26794fb4b9c911e34f9fcb58d13?pvs=21), Ontwikkelen van een marketingstrategie (https://www.notion.so/Ontwikkelen-van-een-marketingstrategie-4366f469850b46869a55699b457c4d3a?pvs=21)"
Bepalen van sleutelresources,1.3,Done,Identificeer de essentiële assets die nodig zijn om de kernactiviteiten uit te voeren en waarde aan klanten te leveren.,"Analyse van middelen, Begrip van de marktbehoefte, Begroting","Inclusief fysieke middelen, intellectueel eigendom, en menselijk kapitaal. Exclusief niet-kritieke ondersteunende middelen.",I want to create a Business model canvas for a marketing company. (https://www.notion.so/I-want-to-create-a-Business-model-canvas-for-a-marketing-company-1d4f77e229914c2f97243a94c0329aaa?pvs=21),"Analyseren van fysieke middelen (https://www.notion.so/Analyseren-van-fysieke-middelen-bdd52833c5714681988a5a97819ca4e5?pvs=21), Evalueren van intellectueel eigendom (https://www.notion.so/Evalueren-van-intellectueel-eigendom-3a1b43e4bcc34cb88d977c9d5f3d1333?pvs=21), Vaststellen van menselijk kapitaal (https://www.notion.so/Vaststellen-van-menselijk-kapitaal-ab54f5403bfa4fbb80e577b7d43666ee?pvs=21)"
Ontwikkelen van waardeproposities,1.4,Done,Definieer kernproducten of -diensten en unique selling propositions (USPs) die je marketingbedrijf zullen differentiëren.,"Creatief denken, Marktonderzoek, Strategische planning","Inclusief marktsegmentatie, klantenbehoeften, en concurrentieanalyse. Exclusief niet-gedefinieerde of irrelevante productaanbiedingen.",I want to create a Business model canvas for a marketing company. (https://www.notion.so/I-want-to-create-a-Business-model-canvas-for-a-marketing-company-1d4f77e229914c2f97243a94c0329aaa?pvs=21),"Identificeren van klantbehoeften (https://www.notion.so/Identificeren-van-klantbehoeften-2630159db60a4a8c809b538118f0803b?pvs=21), Ontwikkelen van unieke waardeproposities (UVPs) (https://www.notion.so/Ontwikkelen-van-unieke-waardeproposities-UVPs-06820f8ee9a74788a3df8e42b1d537e2?pvs=21), Concurrentieanalyse uitvoeren (https://www.notion.so/Concurrentieanalyse-uitvoeren-4f6d8c73f41d48d18fe93f54359a7c1b?pvs=21)"
Ontwikkelen van klantrelaties,1.5,Not started,Bepaal hoe je duurzame relaties met klantsegmenten zult opbouwen en onderhouden.,"CRM kennis, Communicatie en sociale vaardigheden, Klantenservice skills","Inclusief klantenservice strategieën, personalisatie, en community building. Exclusief eenmalige transacties of niet-strategische communicatie.",I want to create a Business model canvas for a marketing company. (https://www.notion.so/I-want-to-create-a-Business-model-canvas-for-a-marketing-company-1d4f77e229914c2f97243a94c0329aaa?pvs=21),
Kiezen van kanalen,1.6,Not started,Identificeer de meest effectieve communicatie- en distributiekanalen om je klanten te bereiken.,"Analytisch vermogen, Ervaring met channel management, Marktkennis","Inclusief online en offline marketingkanalen, verkoop strategieën, en distributiemethoden. Exclusief niet-gevalideerde of theorieële kanalen.",I want to create a Business model canvas for a marketing company. (https://www.notion.so/I-want-to-create-a-Business-model-canvas-for-a-marketing-company-1d4f77e229914c2f97243a94c0329aaa?pvs=21),
Segmenteren van klanten,1.7,Not started,"Identificeer en segmenteer je doelmarkten op basis van demografische, gedrags- en/of psychografische kenmerken.","Analytisch vermogen, Communicatie strategie, Marktonderzoek vaardigheden","Inclusief doelgroepanalyse, marktomvang bepaling, en segmentatiecriteria. Exclusief niet-doelgroepgerelateerde marktsegmenten.",I want to create a Business model canvas for a marketing company. (https://www.notion.so/I-want-to-create-a-Business-model-canvas-for-a-marketing-company-1d4f77e229914c2f97243a94c0329aaa?pvs=21),
Ontwikkelen van kostenstructuur,1.8,Not started,"Analyseer en plan de financiële uitgaven die betrokken zijn bij de bedrijfsvoering, gericht op waardecreatie voor klanten.","Budgetteren, Financiële planning, Kostenanalyse","Inclusief directe en indirecte kosten, schaalvoordelen, en kostenoptimalisatie strategieën. Exclusief financieringsstrategieën of investeringskapitaalbeheer.",I want to create a Business model canvas for a marketing company. (https://www.notion.so/I-want-to-create-a-Business-model-canvas-for-a-marketing-company-1d4f77e229914c2f97243a94c0329aaa?pvs=21),
Vaststellen inkomstenstromen,1.9,Not started,Ontwerp diverse inkomstenmodellen en prijsstrategieën gebaseerd op waardeproposities en klantsegmenten.,"Analytisch vermogen, Kennis van prijsmodellen, Verkoop strategie","Inclusief verkoopmodellen, prijsstrategieën, en inkomstengenererende activiteiten. Exclusief externe financieringsbronnen of niet-duurzame inkomstenmodellen.",I want to create a Business model canvas for a marketing company. (https://www.notion.so/I-want-to-create-a-Business-model-canvas-for-a-marketing-company-1d4f77e229914c2f97243a94c0329aaa?pvs=21),