Name,Index,Status,Description,Requirements,Scope,Laundromat RE Opdrachten,Laundromat AI To-do List,First Level Breakdown,Second Level Breakdown,Related to Laundromat AI To-do List (1) (Laundromat AI Output Level 1),Laundromat AI To-do List (1)
Definieer Project Scope en Doelstellingen,1.1,Done,"Bepaal de omvang, doelstellingen, sleutelresultaten, en streefdoelen voor het project om een efficiënte uitvoering te waarborgen.","Begrip van de bedrijfsdoelstellingen, Inzicht in de e-commerce markt, Kennis van projectmanagement",Inbegrepen: Detaildefinitie van doelstellingen en sleutelresultaten. Uitgesloten: Specificatie van individuele taken.,Put Together a Detailed Project Plan for the Launch of a New E-commerce Platform (https://www.notion.so/Put-Together-a-Detailed-Project-Plan-for-the-Launch-of-a-New-E-commerce-Platform-0db3ae8904e34ab39bbbd84425bcb6f6?pvs=21),"Identify Stakeholders (https://www.notion.so/Identify-Stakeholders-73d4b1dca6204d4d84e049ec61255186?pvs=21), Define Project Objectives (https://www.notion.so/Define-Project-Objectives-16deb0792c5e4d0d8262008252b3a7c6?pvs=21), Establish Key Results (https://www.notion.so/Establish-Key-Results-54054a2094c7460a9b9e71ac9cf8c866?pvs=21), Develop Project Scope Document (https://www.notion.so/Develop-Project-Scope-Document-f1289b627dda4200b4133bd1d29d15fe?pvs=21), Outline Key Project Milestones (https://www.notion.so/Outline-Key-Project-Milestones-75e6142a21af4bf79335e468a8ff27c4?pvs=21)","Bepaal de omvang, doelstellingen, sleutelresultaten, en streefdoelen voor het project om een efficiënte uitvoering te waarborgen. (https://www.notion.so/Bepaal-de-omvang-doelstellingen-sleutelresultaten-en-streefdoelen-voor-het-project-om-een-effici--35f87f9472564d93b4829d9a98b39645?pvs=21)","Bepaal de omvang, doelstellingen, sleutelresultaten, en streefdoelen voor het project om een efficiënte uitvoering te waarborgen. (https://www.notion.so/Bepaal-de-omvang-doelstellingen-sleutelresultaten-en-streefdoelen-voor-het-project-om-een-effici--e378e390de644698aab04d81c76c6b5c?pvs=21), Bepaal de omvang, doelstellingen, sleutelresultaten, en streefdoelen voor het project om een efficiënte uitvoering te waarborgen. (https://www.notion.so/Bepaal-de-omvang-doelstellingen-sleutelresultaten-en-streefdoelen-voor-het-project-om-een-effici--dfb25a8ad8bc44b1b2328f8ca2e803ad?pvs=21), Bepaal de omvang, doelstellingen, sleutelresultaten, en streefdoelen voor het project om een efficiënte uitvoering te waarborgen. (https://www.notion.so/Bepaal-de-omvang-doelstellingen-sleutelresultaten-en-streefdoelen-voor-het-project-om-een-effici--6241d1b33f82427cbc50ab90ea06e72d?pvs=21), Bepaal de omvang, doelstellingen, sleutelresultaten, en streefdoelen voor het project om een efficiënte uitvoering te waarborgen. (https://www.notion.so/Bepaal-de-omvang-doelstellingen-sleutelresultaten-en-streefdoelen-voor-het-project-om-een-effici--5dd04420bf2840a78c03a40facff81bc?pvs=21), Bepaal de omvang, doelstellingen, sleutelresultaten, en streefdoelen voor het project om een efficiënte uitvoering te waarborgen. (https://www.notion.so/Bepaal-de-omvang-doelstellingen-sleutelresultaten-en-streefdoelen-voor-het-project-om-een-effici--fd930ac0cc534bc19ada4427e70b0cfe?pvs=21)",,
Stel een Projectteam samen,1.2,Done,Selecteer de teamleden op basis van benodigde vaardigheden en ervaring voor een succesvolle projectuitvoering.,"Begrip van de benodigde vaardigheden voor project, Communicatievaardigheden, Kennis van de beschikbaarheid van personeel",Inbegrepen: Samenstellen van een divers team. Uitgesloten: Rollen en taken toewijzen.,Put Together a Detailed Project Plan for the Launch of a New E-commerce Platform (https://www.notion.so/Put-Together-a-Detailed-Project-Plan-for-the-Launch-of-a-New-E-commerce-Platform-0db3ae8904e34ab39bbbd84425bcb6f6?pvs=21),"Identify Skill Gaps (https://www.notion.so/Identify-Skill-Gaps-51d2ae674fab405bb75757b5db9db969?pvs=21), Create Recruitment Plan (https://www.notion.so/Create-Recruitment-Plan-f6121eca10264549a935d9d9d7d62f33?pvs=21), Define Role Requirements (https://www.notion.so/Define-Role-Requirements-10139f28da4c4cc5ab77e353e2e46845?pvs=21)",Selecteer de teamleden op basis van benodigde vaardigheden en ervaring voor een succesvolle projectuitvoering. (https://www.notion.so/Selecteer-de-teamleden-op-basis-van-benodigde-vaardigheden-en-ervaring-voor-een-succesvolle-projectu-733f64947af140d5bbafa60792c44fb9?pvs=21),"Selecteer de teamleden op basis van benodigde vaardigheden en ervaring voor een succesvolle projectuitvoering. (https://www.notion.so/Selecteer-de-teamleden-op-basis-van-benodigde-vaardigheden-en-ervaring-voor-een-succesvolle-projectu-e378d60569a64ef9b2409906b081b725?pvs=21), Selecteer de teamleden op basis van benodigde vaardigheden en ervaring voor een succesvolle projectuitvoering. (https://www.notion.so/Selecteer-de-teamleden-op-basis-van-benodigde-vaardigheden-en-ervaring-voor-een-succesvolle-projectu-7ca62f77e4694acfab29ead0eed9839b?pvs=21), Selecteer de teamleden op basis van benodigde vaardigheden en ervaring voor een succesvolle projectuitvoering. (https://www.notion.so/Selecteer-de-teamleden-op-basis-van-benodigde-vaardigheden-en-ervaring-voor-een-succesvolle-projectu-f531d12e3ef24f23a2babcba5bad789c?pvs=21)",,
Ontwikkel een Gedetailleerd Projectplan,1.3,Done,"Stel een gedetailleerd plan samen, inclusief tijdlijn, verantwoordelijkheden, taken, budgetten en middelen voor de uitvoering van het project.","Budgetteringsvaardigheden, Inzicht in tijd en middelenbeheer, Kennis van projectmanagementtools",Inbegrepen: Planning en budgettering. Uitgesloten: Uitvoering van geplande taken.,Put Together a Detailed Project Plan for the Launch of a New E-commerce Platform (https://www.notion.so/Put-Together-a-Detailed-Project-Plan-for-the-Launch-of-a-New-E-commerce-Platform-0db3ae8904e34ab39bbbd84425bcb6f6?pvs=21),"Define Project Scope (https://www.notion.so/Define-Project-Scope-91fe2fddb5734d52a608bc0867226e59?pvs=21), Create Timeline and Milestones (https://www.notion.so/Create-Timeline-and-Milestones-c5e0fb2eb74e4a1a950b6055ac1db2aa?pvs=21), Allocate Responsibilities (https://www.notion.so/Allocate-Responsibilities-19a70b9e3f9c4e09b2d29aa4f23511dc?pvs=21), Budgeting (https://www.notion.so/Budgeting-cdb7d593c05a4382b3eb2a3bf360c2dd?pvs=21), Secure Resources (https://www.notion.so/Secure-Resources-8602ae2cdcff4599bbb61266aa8f3b39?pvs=21)","Stel een gedetailleerd plan samen, inclusief tijdlijn, verantwoordelijkheden, taken, budgetten en middelen voor de uitvoering van het project. (https://www.notion.so/Stel-een-gedetailleerd-plan-samen-inclusief-tijdlijn-verantwoordelijkheden-taken-budgetten-en-mi-0405dacf71e64e8c8d52bfb35f8637ed?pvs=21)","Stel een gedetailleerd plan samen, inclusief tijdlijn, verantwoordelijkheden, taken, budgetten en middelen voor de uitvoering van het project. (https://www.notion.so/Stel-een-gedetailleerd-plan-samen-inclusief-tijdlijn-verantwoordelijkheden-taken-budgetten-en-mi-d68f519e736a4dc08458d114adbea1be?pvs=21), Stel een gedetailleerd plan samen, inclusief tijdlijn, verantwoordelijkheden, taken, budgetten en middelen voor de uitvoering van het project. (https://www.notion.so/Stel-een-gedetailleerd-plan-samen-inclusief-tijdlijn-verantwoordelijkheden-taken-budgetten-en-mi-20709b5fe15246a4ba2c8057cd858a88?pvs=21), Stel een gedetailleerd plan samen, inclusief tijdlijn, verantwoordelijkheden, taken, budgetten en middelen voor de uitvoering van het project. (https://www.notion.so/Stel-een-gedetailleerd-plan-samen-inclusief-tijdlijn-verantwoordelijkheden-taken-budgetten-en-mi-b20ebdf909b5439a8689ccc8951555d1?pvs=21), Stel een gedetailleerd plan samen, inclusief tijdlijn, verantwoordelijkheden, taken, budgetten en middelen voor de uitvoering van het project. (https://www.notion.so/Stel-een-gedetailleerd-plan-samen-inclusief-tijdlijn-verantwoordelijkheden-taken-budgetten-en-mi-0536b91fd00347018614bb9daa4aa9c7?pvs=21), Stel een gedetailleerd plan samen, inclusief tijdlijn, verantwoordelijkheden, taken, budgetten en middelen voor de uitvoering van het project. (https://www.notion.so/Stel-een-gedetailleerd-plan-samen-inclusief-tijdlijn-verantwoordelijkheden-taken-budgetten-en-mi-7c7e8801ab564b7392973b623229a938?pvs=21)",,
Identificeer Risico’s en Management Strategieën,1.4,Not started,Identificeer mogelijke projectrisico's en ontwikkel passende mitigatie- en managementstrategieën om deze risico's te beheren.,"Analytisch denkvermogen, Ervaring met projectmanagement, Kennis van risicomanagement",Inbegrepen: Risicoanalyse en ontwikkeling strategieën. Uitgesloten: De uitvoering van strategieën.,Put Together a Detailed Project Plan for the Launch of a New E-commerce Platform (https://www.notion.so/Put-Together-a-Detailed-Project-Plan-for-the-Launch-of-a-New-E-commerce-Platform-0db3ae8904e34ab39bbbd84425bcb6f6?pvs=21),,Identificeer mogelijke projectrisico's en ontwikkel passende mitigatie- en managementstrategieën om deze risico's te beheren. (https://www.notion.so/Identificeer-mogelijke-projectrisico-s-en-ontwikkel-passende-mitigatie-en-managementstrategie-n-om--1dff20228a9a417d9a9e2f4b75987d22?pvs=21),,,
Ontwikkel Marketing- en Launch Strategie,1.5,Not started,Creëer een gedetailleerd marketingplan en een launchstrategie voor de nieuwe e-commerce platform om de bekendheid en adoptie te maximiseren.,"Begrip van de e-commerce industrie, Creatief denkvermogen, Kennis van digitale marketing",Inbegrepen: Marketingstrategie en promotieplanning. Uitgesloten: Ontwikkeling van het platform.,Put Together a Detailed Project Plan for the Launch of a New E-commerce Platform (https://www.notion.so/Put-Together-a-Detailed-Project-Plan-for-the-Launch-of-a-New-E-commerce-Platform-0db3ae8904e34ab39bbbd84425bcb6f6?pvs=21),,Creëer een gedetailleerd marketingplan en een launchstrategie voor de nieuwe e-commerce platform om de bekendheid en adoptie te maximiseren. (https://www.notion.so/Cre-er-een-gedetailleerd-marketingplan-en-een-launchstrategie-voor-de-nieuwe-e-commerce-platform-om--7188a53688b8414f901d791addbfc4fd?pvs=21),,,
Implementatie en Testen van het Platform,1.6,Not started,"Voer de ontwikkeling, configuratie en uitvoerig testen van het e-commerce platform uit om zeker te zijn van de functionaliteit en gebruikerservaring.","Aandacht voor detail, Ervaring met softwaretesten, Technische ontwikkelingskennis",Inbegrepen: Ontwikkeling en functioneel testen. Uitgesloten: Marktanalyse.,Put Together a Detailed Project Plan for the Launch of a New E-commerce Platform (https://www.notion.so/Put-Together-a-Detailed-Project-Plan-for-the-Launch-of-a-New-E-commerce-Platform-0db3ae8904e34ab39bbbd84425bcb6f6?pvs=21),,"Voer de ontwikkeling, configuratie en uitvoerig testen van het e-commerce platform uit om zeker te zijn van de functionaliteit en gebruikerservaring. (https://www.notion.so/Voer-de-ontwikkeling-configuratie-en-uitvoerig-testen-van-het-e-commerce-platform-uit-om-zeker-te-z-c9d9e5dcae204267a1f7a9b4b03ad455?pvs=21)",,,
Lancering van het Platform,1.7,Not started,"Implementeer de introductiestrategie om het e-commerce platform officieel te lanceren, inclusief alle relevante marketing- en promotieactiviteiten.","Ervaring met productlanceringen, Sterke communicatievaardigheden, Strategische planning",Inbegrepen: Officiële uitrol en promotie. Uitgesloten: Feedbackverzameling en iteraties na lancering.,Put Together a Detailed Project Plan for the Launch of a New E-commerce Platform (https://www.notion.so/Put-Together-a-Detailed-Project-Plan-for-the-Launch-of-a-New-E-commerce-Platform-0db3ae8904e34ab39bbbd84425bcb6f6?pvs=21),,"Implementeer de introductiestrategie om het e-commerce platform officieel te lanceren, inclusief alle relevante marketing- en promotieactiviteiten. (https://www.notion.so/Implementeer-de-introductiestrategie-om-het-e-commerce-platform-officieel-te-lanceren-inclusief-all-af88c189e641487281a88c0bca89fd99?pvs=21)",,,
Evalueren en Itereren,1.8,Not started,"Voer een gedetailleerde evaluatie van het e-commerce platform post-lancering uit, verzamel feedback en maak noodzakelijke aanpassingen om te blijven verbeteren.","Analytisch denkvermepgen, Bereidheid tot aanpassen, Feedbackverzameling vaardigheden",Inbegrepen: Evaluatie en aanpassing. Uitgesloten: Nieuwe functieontwikkeling.,Put Together a Detailed Project Plan for the Launch of a New E-commerce Platform (https://www.notion.so/Put-Together-a-Detailed-Project-Plan-for-the-Launch-of-a-New-E-commerce-Platform-0db3ae8904e34ab39bbbd84425bcb6f6?pvs=21),,"Voer een gedetailleerde evaluatie van het e-commerce platform post-lancering uit, verzamel feedback en maak noodzakelijke aanpassingen om te blijven verbeteren. (https://www.notion.so/Voer-een-gedetailleerde-evaluatie-van-het-e-commerce-platform-post-lancering-uit-verzamel-feedback--c93d2785361947ec893ae31f416a1790?pvs=21)",,,